2026-01-30 12:32:46,392 - INFO - Logging initialized. Log file: c:\Users\Daan\greenfoot\Documents\GitHub\Quant-Finance-Assignment-1\log_assignment\run_20260130_123246.log
2026-01-30 12:32:47,110 - INFO - Initial Returns Data (R - continuously compounded daily returns in percentage points):
2026-01-30 12:32:47,111 - INFO -   Number of observations: 2516
2026-01-30 12:32:47,112 - INFO -   Date range: 2014-01-02 00:00:00 to 2023-12-29 00:00:00
2026-01-30 12:32:47,113 - INFO -   Statistics:
2026-01-30 12:32:47,113 - INFO -     Min: -8.182250
2026-01-30 12:32:47,114 - INFO -     Max: 6.066580
2026-01-30 12:32:47,114 - INFO -     Mean: 0.006821
2026-01-30 12:32:47,115 - INFO -     Std: 0.946441
2026-01-30 12:32:47,115 - INFO - 
----------------------------------------
 A1.1 Stylized Facts of Returns and Realised Variance 
----------------------------------------
2026-01-30 12:32:47,125 - INFO - A1.1.1 Mean of Returns: 0.006821
2026-01-30 12:32:47,125 - INFO - A1.1.1 Standard Deviation of Returns: 0.946441
2026-01-30 12:32:47,126 - INFO - A1.1.1 Kurtosis of Returns: 7.147513
2026-01-30 12:32:47,126 - INFO - A1.1.1 Skew of Returns: -0.673311
2026-01-30 12:32:47,126 - INFO - A1.1.1 Jarque-Bera test statistic of Returns: 5545.719216
2026-01-30 12:32:47,127 - INFO - A1.1.1 Jarque-Bera test p-value of Returns: 0.000000
2026-01-30 12:32:48,310 - INFO - A1.1.2 ACF values of Returns: [ 1.          0.02318542  0.0261453  -0.01651103 -0.0628296  -0.02656015
  0.03690219  0.03515872  0.02810959  0.02992156 -0.03138605 -0.03325255
  0.01015165  0.00912579 -0.01696393  0.01974055  0.01757875 -0.00691712
 -0.00255057 -0.0157828  -0.01466967]
2026-01-30 12:32:48,311 - INFO - A1.1.2 PACF values of Returns: [ 1.          0.02319464  0.02564191 -0.01773805 -0.0629135  -0.0230151
  0.04141018  0.03318383  0.01997639  0.02526854 -0.02908543 -0.02726162
  0.01727687  0.0118405  -0.02458097  0.01162265  0.01885247 -0.00440252
 -0.00347877 -0.01273419 -0.01049769]
2026-01-30 12:32:49,564 - INFO - A1.1.3 ACF values of Squared Returns: [1.         0.21374618 0.22516606 0.20060051 0.20783497 0.1382243
 0.1881327  0.19671785 0.09001006 0.15578955 0.09997493 0.13567053
 0.14088131 0.12646984 0.09355797 0.07377704 0.0767241  0.03861339
 0.04961219 0.01705887 0.0296357 ]
2026-01-30 12:32:49,565 - INFO - A1.1.3 ACF values of Absolute Returns: [1.         0.19920078 0.16379483 0.18266608 0.17420021 0.12117347
 0.16304852 0.1571762  0.10950964 0.14281093 0.11315781 0.14383244
 0.15215774 0.11826972 0.09519517 0.0802725  0.08866218 0.05555526
 0.09328163 0.05968674 0.04897724]
2026-01-30 12:32:52,228 - INFO - A1.1.4 Mean of Standardised Returns: 0.029757
2026-01-30 12:32:52,229 - INFO - A1.1.4 Standard Deviation of Standardised Returns: 0.904237
2026-01-30 12:32:52,229 - INFO - A1.1.4 Kurtosis of Standardised Returns: 0.036235
2026-01-30 12:32:52,230 - INFO - A1.1.4 Skew of Standardised Returns: -0.066715
2026-01-30 12:32:52,230 - INFO - A1.1.4 Jarque-Bera test statistic of Standardised Returns: 2.004052
2026-01-30 12:32:52,230 - INFO - A1.1.4 Jarque-Bera test p-value of Standardised Returns: 0.367135
2026-01-30 12:32:53,355 - INFO - A1.1.4 ACF values of Standardised Returns: [ 1.00000000e+00  3.47869029e-02  2.66286946e-02  3.55745029e-02
 -2.05311530e-02  2.10141873e-02 -2.00966792e-03  1.78140548e-02
  1.68056430e-02  7.14055249e-03 -2.02796235e-03 -6.10604076e-03
  2.47845696e-02  4.31172133e-02 -2.06647234e-02  7.62530150e-03
 -5.23359973e-03 -4.95523729e-04 -1.08154170e-02  4.79553792e-03
 -1.63433287e-02]
2026-01-30 12:32:53,357 - INFO - A1.1.4 PACF values of Standardised Returns: [ 1.          0.03480073  0.02546963  0.0338898  -0.0236396   0.02083841
 -0.00354753  0.01863432  0.01384062  0.00638746 -0.00511726 -0.00637304
  0.02509346  0.04221725 -0.0252697   0.00474915 -0.00669767  0.0021304
 -0.01346306  0.0070358  -0.0193898 ]
2026-01-30 12:32:54,613 - INFO - 
----------------------------------------
 A1.1 (Part II)Properties of Realised Variance 
----------------------------------------
2026-01-30 12:32:54,624 - INFO - A1.1.5 Mean of Realised Variance: 1.134218
2026-01-30 12:32:54,625 - INFO - A1.1.5 Standard Deviation of Realised Variance: 4.188957
2026-01-30 12:32:54,625 - INFO - A1.1.5 Kurtosis of Realised Variance: 1202.722888
2026-01-30 12:32:54,626 - INFO - A1.1.5 Skew of Realised Variance: 30.665583
2026-01-30 12:32:54,626 - INFO - A1.1.5 Jarque-Bera test statistic of Realised Variance: 152040187.699413
2026-01-30 12:32:54,626 - INFO - A1.1.5 Jarque-Bera test p-value of Realised Variance: 0.000000
2026-01-30 12:32:54,633 - INFO - A1.1.6 ACF values of Realised Variance: [1.         0.24261004 0.23826886 0.20183926 0.17420837 0.16209681
 0.13350051 0.14984458 0.11521342 0.12662288 0.10726973 0.106095
 0.08811382 0.07884938 0.07188731 0.05606012 0.05453454 0.04599442
 0.04509027 0.03133569 0.03047094]
2026-01-30 12:32:54,635 - INFO - A1.1.6 PACF values of Realised Variance: [ 1.00000000e+00  2.42706508e-01  1.90790767e-01  1.20132703e-01
  7.87720047e-02  6.54903606e-02  3.47868559e-02  6.12701297e-02
  2.02632671e-02  4.03136689e-02  1.97625403e-02  2.36854047e-02
  6.21927373e-03  4.29012891e-03  2.72243102e-03 -6.52665319e-03
 -8.43429803e-04 -2.49217807e-03  1.47922870e-03 -9.07197688e-03
 -3.42720291e-03]
2026-01-30 12:32:55,954 - INFO - A1.1.7 Mean of Log Realised Variance: -0.365039
2026-01-30 12:32:55,954 - INFO - A1.1.7 Standard Deviation of Log Realised Variance: 0.771472
2026-01-30 12:32:55,954 - INFO - A1.1.7 Kurtosis of Log Realised Variance: 3.656018
2026-01-30 12:32:55,955 - INFO - A1.1.7 Skew of Log Realised Variance: 1.127745
2026-01-30 12:32:55,955 - INFO - A1.1.7 Jarque-Bera test statistic of Log Realised Variance: 1934.562536
2026-01-30 12:32:55,955 - INFO - A1.1.7 Jarque-Bera test p-value of Log Realised Variance: 0.000000
2026-01-30 12:32:57,098 - INFO - A1.1.8 ACF values of Log Realised Variance: [1.         0.66640613 0.60124365 0.56357263 0.52571146 0.49863562
 0.48258634 0.47362801 0.45248195 0.44814025 0.43584375 0.41733693
 0.38454878 0.37275566 0.34667764 0.34398134 0.33931405 0.32717635
 0.32197177 0.30587537 0.2892259 ]
2026-01-30 12:32:57,100 - INFO - A1.1.8 PACF values of Log Realised Variance: [ 1.          0.6666711   0.28309191  0.17206141  0.09838271  0.07459946
  0.07185693  0.07222905  0.0367252   0.05561351  0.03662599  0.01574927
 -0.0240982   0.00730733 -0.01834906  0.02377129  0.02372951  0.00814888
  0.01660327 -0.00465382 -0.01199424]
2026-01-30 12:32:58,425 - INFO - A1.1.9 Squared Returns stats: mean=0.895440, std=2.705799, skew=11.181108, kurtosis=191.420302
2026-01-30 12:32:58,426 - INFO - A1.1.9 ACF squared returns: [1.         0.21374618 0.22516606 0.20060051 0.20783497 0.1382243
 0.1881327  0.19671785 0.09001006 0.15578955 0.09997493 0.13567053
 0.14088131 0.12646984 0.09355797 0.07377704 0.0767241  0.03861339
 0.04961219 0.01705887 0.0296357 ]
2026-01-30 12:32:58,427 - INFO - A1.1.9 PACF squared returns: [ 1.00000000e+00  2.13831169e-01  1.88227912e-01  1.31971223e-01
  1.24739756e-01  3.33246643e-02  9.60797920e-02  1.00583539e-01
 -3.51422180e-02  6.13744349e-02 -6.43612298e-03  4.67502504e-02
  6.14144503e-02  1.88244161e-02 -7.90875610e-04 -1.94836731e-02
 -1.00957758e-02 -3.04414321e-02 -2.01514123e-02 -3.89043525e-02
 -9.60024965e-03]
2026-01-30 12:33:01,889 - INFO - 
----------------------------------------
 A1.2 Historical Volatility 
----------------------------------------
2026-01-30 12:33:02,370 - INFO - A1.2 Mean Historical Variance for T=63: 0.901139
2026-01-30 12:33:02,371 - INFO - A1.2 Mean Historical Variance for T=125: 0.909416
2026-01-30 12:33:02,372 - INFO - A1.2 Mean Historical Variance for T=250: 0.924462
2026-01-30 12:33:02,372 - INFO - A1.2 Std Historical Variance for T=63: 0.805162
2026-01-30 12:33:02,372 - INFO - A1.2 Std Historical Variance for T=125: 0.586618
2026-01-30 12:33:02,373 - INFO - A1.2 Std Historical Variance for T=250: 0.436243
2026-01-30 12:33:03,452 - INFO - 
----------------------------------------
 A1.3 Riskmetric Model 
----------------------------------------
2026-01-30 12:33:03,454 - INFO - A1.3.1 Initialise sigma 0: 0.565490
2026-01-30 12:33:03,455 - INFO - A1.3.1 Initialise lambda: 0.940000
2026-01-30 12:33:03,495 - INFO - A1.3.3 Mean Riskmetric Volatility: 0.902821
2026-01-30 12:33:03,495 - INFO - A1.3.3 Std Riskmetric Volatility: 0.992910
2026-01-30 12:33:05,837 - INFO - 
----------------------------------------
 A1.4 GARCH(1,1) Model, Assuming Normal Distribution of zt 
----------------------------------------
2026-01-30 12:33:05,838 - INFO - A1.4.1 Sample Period: 1258 observations
2026-01-30 12:33:05,901 - INFO - A.1.4.1 GARCH(1,1) Model Results:                      Constant Mean - GARCH Model Results                      
==============================================================================
Dep. Variable:                      R   R-squared:                       0.000
Mean Model:             Constant Mean   Adj. R-squared:                  0.000
Vol Model:                      GARCH   Log-Likelihood:               -1530.35
Distribution:                  Normal   AIC:                           3068.70
Method:            Maximum Likelihood   BIC:                           3089.25
                                        No. Observations:                 1258
Date:                Fri, Jan 30 2026   Df Residuals:                     1257
Time:                        12:33:05   Df Model:                            1
                                  Mean Model                                 
=============================================================================
                 coef    std err          t      P>|t|       95.0% Conf. Int.
-----------------------------------------------------------------------------
mu             0.0164  2.519e-02      0.650      0.516 [-3.300e-02,6.576e-02]
                               Volatility Model                              
=============================================================================
                 coef    std err          t      P>|t|       95.0% Conf. Int.
-----------------------------------------------------------------------------
omega          0.0187  1.406e-02      1.329      0.184 [-8.862e-03,4.623e-02]
alpha[1]       0.0715  2.156e-02      3.315  9.177e-04    [2.921e-02,  0.114]
beta[1]        0.9094  3.573e-02     25.454 6.412e-143      [  0.839,  0.979]
=============================================================================

Covariance estimator: robust
2026-01-30 12:33:07,745 - INFO - A1.4.4 Mean of Standardised Returns: -0.000937
2026-01-30 12:33:07,746 - INFO - A1.4.4 Standard Deviation of Standardised Returns: 0.999915
2026-01-30 12:33:07,746 - INFO - A1.4.4 Kurtosis of Standardised Returns: 7.533211
2026-01-30 12:33:07,747 - INFO - A1.4.4 Skew of Standardised Returns: -0.938868
2026-01-30 12:33:07,747 - INFO - A1.4.4 Jarque-Bera test statistic of Standardised Returns: 3159.422863
2026-01-30 12:33:07,747 - INFO - A1.4.4 Jarque-Bera test p-value of Standardised Returns: 0.000000
2026-01-30 12:33:11,479 - INFO - 
----------------------------------------
 A1.5 ARCH(1) Model, Assuming Normal Distribution of zt 
----------------------------------------
2026-01-30 12:33:11,480 - INFO - A1.5.1 Sample Period: 1258 observations
2026-01-30 12:33:11,517 - INFO - A.1.5.1 ARCH(1) Model Results:                       Constant Mean - ARCH Model Results                      
==============================================================================
Dep. Variable:                      R   R-squared:                       0.000
Mean Model:             Constant Mean   Adj. R-squared:                  0.000
Vol Model:                       ARCH   Log-Likelihood:               -1575.80
Distribution:                  Normal   AIC:                           3157.60
Method:            Maximum Likelihood   BIC:                           3173.01
                                        No. Observations:                 1258
Date:                Fri, Jan 30 2026   Df Residuals:                     1257
Time:                        12:33:11   Df Model:                            1
                                  Mean Model                                 
=============================================================================
                 coef    std err          t      P>|t|       95.0% Conf. Int.
-----------------------------------------------------------------------------
mu         8.7010e-04  2.784e-02  3.125e-02      0.975 [-5.370e-02,5.544e-02]
                             Volatility Model                             
==========================================================================
                 coef    std err          t      P>|t|    95.0% Conf. Int.
--------------------------------------------------------------------------
omega          0.6006  6.903e-02      8.701  3.296e-18   [  0.465,  0.736]
alpha[1]       0.2181  8.054e-02      2.707  6.781e-03 [6.020e-02,  0.376]
==========================================================================

Covariance estimator: robust
2026-01-30 12:33:13,469 - INFO - A1.5.5 Mean of Standardised Returns: 0.009092
2026-01-30 12:33:13,469 - INFO - A1.5.5 Standard Deviation of Standardised Returns: 1.000356
2026-01-30 12:33:13,470 - INFO - A1.5.5 Kurtosis of Standardised Returns: 9.883057
2026-01-30 12:33:13,470 - INFO - A1.5.5 Skew of Standardised Returns: -1.266004
2026-01-30 12:33:13,471 - INFO - A1.5.5 Jarque-Bera test statistic of Standardised Returns: 5455.834455
2026-01-30 12:33:13,471 - INFO - A1.5.5 Jarque-Bera test p-value of Standardised Returns: 0.000000
2026-01-30 12:33:18,734 - INFO - 
----------------------------------------
 A1.6 Threshold GARCH (asymmetric) and GARCH-X 
----------------------------------------
2026-01-30 12:33:18,736 - INFO - A1.6.1 Sample Period: 1258 observations
2026-01-30 12:33:18,821 - INFO - A1.6.2 Threshold Garch Model Results:
                   Constant Mean - GJR-GARCH Model Results                    
==============================================================================
Dep. Variable:                      R   R-squared:                       0.000
Mean Model:             Constant Mean   Adj. R-squared:                  0.000
Vol Model:                  GJR-GARCH   Log-Likelihood:               -1529.29
Distribution:                  Normal   AIC:                           3068.59
Method:            Maximum Likelihood   BIC:                           3094.27
                                        No. Observations:                 1258
Date:                Fri, Jan 30 2026   Df Residuals:                     1257
Time:                        12:33:18   Df Model:                            1
                                  Mean Model                                 
=============================================================================
                 coef    std err          t      P>|t|       95.0% Conf. Int.
-----------------------------------------------------------------------------
mu             0.0139  2.449e-02      0.569      0.569 [-3.407e-02,6.194e-02]
                               Volatility Model                              
=============================================================================
                 coef    std err          t      P>|t|       95.0% Conf. Int.
-----------------------------------------------------------------------------
omega          0.0186  1.342e-02      1.385      0.166 [-7.712e-03,4.488e-02]
alpha[1]       0.0460  3.608e-02      1.274      0.203   [-2.475e-02,  0.117]
gamma[1]       0.0345  4.051e-02      0.851      0.394   [-4.491e-02,  0.114]
beta[1]        0.9161  3.156e-02     29.024 3.237e-185      [  0.854,  0.978]
=============================================================================

Covariance estimator: robust
2026-01-30 12:33:18,824 - INFO - Estimating GARCH-X model...
2026-01-30 12:33:19,426 - INFO - A1.6.3 GARCHX Model Results:
2026-01-30 12:33:19,427 - INFO -   Parameters:
2026-01-30 12:33:19,428 - INFO -     mu:    0.015141 (std err: 0.021094)
2026-01-30 12:33:19,428 - INFO -     omega: 0.046813 (std err: 0.009237)
2026-01-30 12:33:19,429 - INFO -     alpha: 0.064475 (std err: 0.017209)
2026-01-30 12:33:19,429 - INFO -     beta:  0.537004 (std err: 0.017162)
2026-01-30 12:33:19,429 - INFO -     delta: 0.334625 (std err: 0.018743)
2026-01-30 12:33:19,430 - INFO -   alpha + beta: 0.601479
2026-01-30 12:33:19,430 - INFO -   Log-likelihood: -1498.54
2026-01-30 12:33:19,430 - INFO -   Delta t-statistic: 17.854 (significant if |t| > 1.96)
2026-01-30 12:33:19,438 - INFO - A1.6.3 Date: 2016-01-26 | Return: 3.951330 | RV: 2.120313
2026-01-30 12:33:19,439 - INFO -   GARCH variance: 0.717373
2026-01-30 12:33:19,439 - INFO -   Threshold GARCH variance: 0.737269
2026-01-30 12:33:19,440 - INFO -   GARCH-X variance: 1.695979
2026-01-30 12:33:19,442 - INFO - A1.6.3 Date: 2018-12-14 | Return: -8.182250 | RV: 25.133153
2026-01-30 12:33:19,443 - INFO -   GARCH variance: 0.804099
2026-01-30 12:33:19,443 - INFO -   Threshold GARCH variance: 0.772926
2026-01-30 12:33:19,444 - INFO -   GARCH-X variance: 1.284989
2026-01-30 12:33:21,406 - INFO - 
----------------------------------------
 A1.7 Forecasting Volatility 
----------------------------------------
2026-01-30 12:33:21,407 - INFO - A1.7.1 Forecast Period: 1258 observations
2026-01-30 12:33:21,408 - INFO - A1.7.1 Variance Proxy (Squared Returns): 1258 observations
2026-01-30 12:33:21,409 - INFO - Generating rolling one-step-ahead forecasts for GARCH models...
2026-01-30 12:48:59,095 - INFO - 
=== A1.7 Part 1: MSPE using Squared Returns as proxy ===
2026-01-30 12:48:59,097 - INFO - A1.7.1 MSPE for Historical_Variance_T126: 8.417541
2026-01-30 12:48:59,098 - INFO - A1.7.1 MSPE for Riskmetric: 7.335407
2026-01-30 12:48:59,098 - INFO - A1.7.1 MSPE for ARCH: 7.546467
2026-01-30 12:48:59,099 - INFO - A1.7.1 MSPE for GARCH: 6.879295
2026-01-30 12:48:59,099 - INFO - A1.7.1 MSPE for Threshold_GARCH: 7.026543
2026-01-30 12:48:59,100 - INFO - A1.7.1 MSPE for GARCH_X: 5.733033
2026-01-30 12:48:59,100 - INFO - 
Ranking of models by MSPE (Squared Returns proxy):
2026-01-30 12:48:59,101 - INFO -   1. GARCH_X: 5.733033
2026-01-30 12:48:59,101 - INFO -   2. GARCH: 6.879295
2026-01-30 12:48:59,102 - INFO -   3. Threshold_GARCH: 7.026543
2026-01-30 12:48:59,102 - INFO -   4. Riskmetric: 7.335407
2026-01-30 12:48:59,102 - INFO -   5. ARCH: 7.546467
2026-01-30 12:48:59,103 - INFO -   6. Historical_Variance_T126: 8.417541
2026-01-30 12:48:59,103 - INFO - 
=== A1.7 Part 2: MSPE using Realised Variance (RV) as proxy ===
2026-01-30 12:48:59,104 - INFO - A1.7.1 MSPE for Historical_Variance_T126 (RV): 9.214405
2026-01-30 12:48:59,105 - INFO - A1.7.1 MSPE for Riskmetric (RV): 7.093666
2026-01-30 12:48:59,105 - INFO - A1.7.1 MSPE for ARCH (RV): 7.510394
2026-01-30 12:48:59,106 - INFO - A1.7.1 MSPE for GARCH (RV): 6.606238
2026-01-30 12:48:59,106 - INFO - A1.7.1 MSPE for Threshold_GARCH (RV): 6.803516
2026-01-30 12:48:59,107 - INFO - A1.7.1 MSPE for GARCH_X (RV): 3.687225
2026-01-30 12:48:59,107 - INFO - 
Ranking of models by MSPE (Realized Variance proxy):
2026-01-30 12:48:59,108 - INFO -   1. GARCH_X: 3.687225
2026-01-30 12:48:59,109 - INFO -   2. GARCH: 6.606238
2026-01-30 12:48:59,110 - INFO -   3. Threshold_GARCH: 6.803516
2026-01-30 12:48:59,111 - INFO -   4. Riskmetric: 7.093666
2026-01-30 12:48:59,111 - INFO -   5. ARCH: 7.510394
2026-01-30 12:48:59,112 - INFO -   6. Historical_Variance_T126: 9.214405
2026-01-30 12:48:59,112 - INFO - 
=== Comparison of Rankings ===
2026-01-30 12:48:59,112 - INFO - Differences in model rankings between proxies:
2026-01-30 12:49:00,136 - INFO - 
=== A1.7 Part 3: Analysis of January 9 - February 17, 2023 ===
2026-01-30 12:49:00,139 - INFO - Period: 2023-01-09 00:00:00 to 2023-02-17 00:00:00
2026-01-30 12:49:00,140 - INFO - Important date: January 24, 2023 (index 2280)
2026-01-30 12:49:00,141 - INFO - Return on Jan 24, 2023: -3.8978%
2026-01-30 12:49:00,141 - INFO - Realized Variance on Jan 24, 2023: 8.9162
2026-01-30 12:49:01,016 - INFO - 
Analysis around January 24, 2023:
2026-01-30 12:49:01,017 - INFO -   2023-01-20 00:00:00: RV=0.7441, GARCH=0.6963, TGARCH=0.7474, GARCHX=0.5742
2026-01-30 12:49:01,018 - INFO -   2023-01-23 00:00:00: RV=0.6486, GARCH=0.7012, TGARCH=0.7560, GARCHX=0.7123
2026-01-30 12:49:01,018 - INFO -   2023-01-24 00:00:00: RV=8.9162, GARCH=0.6756, TGARCH=0.7271, GARCHX=0.6894
2026-01-30 12:49:01,019 - INFO -   2023-01-25 00:00:00: RV=1.5058, GARCH=1.7112, TGARCH=2.0523, GARCHX=1.3208
2026-01-30 12:49:01,019 - INFO -   2023-01-26 00:00:00: RV=0.6853, GARCH=1.6958, TGARCH=1.9592, GARCHX=3.3135
2026-01-30 12:49:01,020 - INFO -   2023-01-27 00:00:00: RV=0.4199, GARCH=1.5558, TGARCH=1.7879, GARCHX=2.3308
2026-01-30 12:49:01,020 - INFO -   2023-01-30 00:00:00: RV=3.5972, GARCH=1.4236, TGARCH=1.6263, GARCHX=1.5704
2026-01-30 12:49:01,021 - INFO - 
=== A1.7 Part 4: Analysis of July 3 - August 11, 2023 ===
2026-01-30 12:49:01,023 - INFO - Period: 2023-07-03 00:00:00 to 2023-08-11 00:00:00
2026-01-30 12:49:01,024 - INFO - Highest return in period: 3.8997% on 2023-07-20 00:00:00
2026-01-30 12:49:01,025 - INFO - Realized Variance on that day: 4.1091
2026-01-30 12:49:01,928 - INFO - 
Analysis around highest return day (2023-07-20 00:00:00):
2026-01-30 12:49:01,929 - INFO -   2023-07-18 00:00:00: RV=0.5162, GARCH=0.4827, TGARCH=0.4868, GARCHX=0.5046
2026-01-30 12:49:01,929 - INFO -   2023-07-19 00:00:00: RV=1.0673, GARCH=0.4638, TGARCH=0.4681, GARCHX=0.5703
2026-01-30 12:49:01,930 - INFO -   2023-07-20 00:00:00: RV=4.1091, GARCH=0.4655, TGARCH=0.4653, GARCHX=0.5537
2026-01-30 12:49:01,931 - INFO -   2023-07-21 00:00:00: RV=1.1852, GARCH=1.4890, TGARCH=1.2143, GARCHX=1.2672
2026-01-30 12:49:01,932 - INFO -   2023-07-24 00:00:00: RV=1.2897, GARCH=1.4559, TGARCH=1.1880, GARCHX=1.9108
2026-01-30 12:49:01,933 - INFO -   2023-07-25 00:00:00: RV=0.5589, GARCH=1.3347, TGARCH=1.0907, GARCHX=1.4923
2026-01-30 12:49:01,933 - INFO -   2023-07-26 00:00:00: RV=1.3265, GARCH=1.3101, TGARCH=1.0709, GARCHX=1.3258
2026-01-30 12:49:01,934 - INFO - 
========================================
2026-01-30 12:49:01,934 - INFO -  A1.8 Value-at-Risk (VaR) Analysis
2026-01-30 12:49:01,935 - INFO - ========================================
2026-01-30 12:49:01,935 - INFO - 
Constructing 1-day ahead VaR estimates at 90%, 95%, and 99% confidence levels
2026-01-30 12:49:01,936 - INFO - for the period January 2, 2019 - December 31, 2023
2026-01-30 12:49:01,937 - INFO - DEBUG: Confidence 90% -> z_score = -1.2816
2026-01-30 12:49:01,937 - INFO -   DEBUG GARCH: mean volatility = 0.9617
2026-01-30 12:49:01,938 - INFO -   DEBUG GARCH: mean VaR = -1.2325
2026-01-30 12:49:01,938 - INFO -   DEBUG GARCH: min VaR = -4.6156
2026-01-30 12:49:01,938 - INFO -   DEBUG GARCH: max VaR = -0.7637
2026-01-30 12:49:01,939 - INFO - DEBUG: Confidence 95% -> z_score = -1.6449
2026-01-30 12:49:01,940 - INFO -   DEBUG GARCH: mean volatility = 0.9617
2026-01-30 12:49:01,940 - INFO -   DEBUG GARCH: mean VaR = -1.5819
2026-01-30 12:49:01,940 - INFO -   DEBUG GARCH: min VaR = -5.9241
2026-01-30 12:49:01,941 - INFO -   DEBUG GARCH: max VaR = -0.9802
2026-01-30 12:49:01,941 - INFO - DEBUG: Confidence 99% -> z_score = -2.3263
2026-01-30 12:49:01,942 - INFO -   DEBUG GARCH: mean volatility = 0.9617
2026-01-30 12:49:01,942 - INFO -   DEBUG GARCH: mean VaR = -2.2372
2026-01-30 12:49:01,943 - INFO -   DEBUG GARCH: min VaR = -8.3785
2026-01-30 12:49:01,943 - INFO -   DEBUG GARCH: max VaR = -1.3863
2026-01-30 12:49:02,024 - INFO - 
DEBUG Returns: mean=-0.0015, min=-6.0620, max=6.0666
2026-01-30 12:49:02,025 - INFO - 
DEBUG 90% GARCH:
2026-01-30 12:49:02,027 - INFO -   Mean VaR: -1.2325
2026-01-30 12:49:02,027 - INFO -   Violations: 102 / 1258 (8.11%)
2026-01-30 12:49:02,028 - INFO -   Expected: 125.8 (10.00%)
2026-01-30 12:49:02,029 - INFO -   First 5 returns: [-0.29701444 -1.90271057  0.5569734  -0.48696295  1.37913397]
2026-01-30 12:49:02,029 - INFO -   First 5 VaRs: [-2.42896304 -2.3202613  -2.31502738 -2.21767253 -2.12413751]
2026-01-30 12:49:02,030 - INFO -   Violations in first 5: 0
2026-01-30 12:49:02,030 - INFO - 
DEBUG 95% GARCH:
2026-01-30 12:49:02,031 - INFO -   Mean VaR: -1.5819
2026-01-30 12:49:02,031 - INFO -   Violations: 68 / 1258 (5.41%)
2026-01-30 12:49:02,032 - INFO -   Expected: 62.9 (5.00%)
2026-01-30 12:49:02,033 - INFO -   First 5 returns: [-0.29701444 -1.90271057  0.5569734  -0.48696295  1.37913397]
2026-01-30 12:49:02,033 - INFO -   First 5 VaRs: [-3.11754031 -2.97802313 -2.97130548 -2.84635187 -2.72630098]
2026-01-30 12:49:02,034 - INFO -   Violations in first 5: 0
2026-01-30 12:49:02,034 - INFO - 
DEBUG 99% GARCH:
2026-01-30 12:49:02,034 - INFO -   Mean VaR: -2.2372
2026-01-30 12:49:02,035 - INFO -   Violations: 26 / 1258 (2.07%)
2026-01-30 12:49:02,035 - INFO -   Expected: 12.6 (1.00%)
2026-01-30 12:49:02,036 - INFO -   First 5 returns: [-0.29701444 -1.90271057  0.5569734  -0.48696295  1.37913397]
2026-01-30 12:49:02,037 - INFO -   First 5 VaRs: [-4.40919675 -4.21187495 -4.20237404 -4.02564977 -3.85585951]
2026-01-30 12:49:02,038 - INFO -   Violations in first 5: 0
2026-01-30 12:49:02,038 - INFO - 
============================================================
2026-01-30 12:49:02,039 - INFO - VaR VIOLATION STATISTICS
2026-01-30 12:49:02,039 - INFO - ============================================================
2026-01-30 12:49:02,039 - INFO - 
============================================================
2026-01-30 12:49:02,040 - INFO -   Confidence Level: 90%
2026-01-30 12:49:02,040 - INFO -   Expected Violation Rate: 10.00%
2026-01-30 12:49:02,041 - INFO - ============================================================
2026-01-30 12:49:02,041 - INFO - 
  Historical_Variance_T126:
2026-01-30 12:49:02,042 - INFO -     Violations: 97 / 1258
2026-01-30 12:49:02,042 - INFO -     Actual Rate: 7.71%
2026-01-30 12:49:02,042 - INFO -     Expected Rate: 10.00%
2026-01-30 12:49:02,043 - INFO -     Difference: -2.29%
2026-01-30 12:49:02,043 - INFO - 
  Riskmetric:
2026-01-30 12:49:02,044 - INFO -     Violations: 104 / 1258
2026-01-30 12:49:02,044 - INFO -     Actual Rate: 8.27%
2026-01-30 12:49:02,045 - INFO -     Expected Rate: 10.00%
2026-01-30 12:49:02,045 - INFO -     Difference: -1.73%
2026-01-30 12:49:02,046 - INFO - 
  ARCH:
2026-01-30 12:49:02,046 - INFO -     Violations: 119 / 1258
2026-01-30 12:49:02,047 - INFO -     Actual Rate: 9.46%
2026-01-30 12:49:02,047 - INFO -     Expected Rate: 10.00%
2026-01-30 12:49:02,048 - INFO -     Difference: -0.54%
2026-01-30 12:49:02,048 - INFO - 
  GARCH:
2026-01-30 12:49:02,049 - INFO -     Violations: 102 / 1258
2026-01-30 12:49:02,049 - INFO -     Actual Rate: 8.11%
2026-01-30 12:49:02,050 - INFO -     Expected Rate: 10.00%
2026-01-30 12:49:02,050 - INFO -     Difference: -1.89%
2026-01-30 12:49:02,051 - INFO - 
  Threshold_GARCH:
2026-01-30 12:49:02,051 - INFO -     Violations: 103 / 1258
2026-01-30 12:49:02,051 - INFO -     Actual Rate: 8.19%
2026-01-30 12:49:02,052 - INFO -     Expected Rate: 10.00%
2026-01-30 12:49:02,052 - INFO -     Difference: -1.81%
2026-01-30 12:49:02,053 - INFO - 
  GARCH_X:
2026-01-30 12:49:02,053 - INFO -     Violations: 100 / 1258
2026-01-30 12:49:02,054 - INFO -     Actual Rate: 7.95%
2026-01-30 12:49:02,054 - INFO -     Expected Rate: 10.00%
2026-01-30 12:49:02,055 - INFO -     Difference: -2.05%
2026-01-30 12:49:02,055 - INFO - 
============================================================
2026-01-30 12:49:02,055 - INFO -   Confidence Level: 95%
2026-01-30 12:49:02,056 - INFO -   Expected Violation Rate: 5.00%
2026-01-30 12:49:02,056 - INFO - ============================================================
2026-01-30 12:49:02,057 - INFO - 
  Historical_Variance_T126:
2026-01-30 12:49:02,057 - INFO -     Violations: 62 / 1258
2026-01-30 12:49:02,058 - INFO -     Actual Rate: 4.93%
2026-01-30 12:49:02,058 - INFO -     Expected Rate: 5.00%
2026-01-30 12:49:02,059 - INFO -     Difference: -0.07%
2026-01-30 12:49:02,059 - INFO - 
  Riskmetric:
2026-01-30 12:49:02,060 - INFO -     Violations: 69 / 1258
2026-01-30 12:49:02,060 - INFO -     Actual Rate: 5.48%
2026-01-30 12:49:02,061 - INFO -     Expected Rate: 5.00%
2026-01-30 12:49:02,061 - INFO -     Difference: +0.48%
2026-01-30 12:49:02,061 - INFO - 
  ARCH:
2026-01-30 12:49:02,062 - INFO -     Violations: 67 / 1258
2026-01-30 12:49:02,063 - INFO -     Actual Rate: 5.33%
2026-01-30 12:49:02,063 - INFO -     Expected Rate: 5.00%
2026-01-30 12:49:02,064 - INFO -     Difference: +0.33%
2026-01-30 12:49:02,064 - INFO - 
  GARCH:
2026-01-30 12:49:02,065 - INFO -     Violations: 68 / 1258
2026-01-30 12:49:02,065 - INFO -     Actual Rate: 5.41%
2026-01-30 12:49:02,066 - INFO -     Expected Rate: 5.00%
2026-01-30 12:49:02,066 - INFO -     Difference: +0.41%
2026-01-30 12:49:02,067 - INFO - 
  Threshold_GARCH:
2026-01-30 12:49:02,067 - INFO -     Violations: 68 / 1258
2026-01-30 12:49:02,068 - INFO -     Actual Rate: 5.41%
2026-01-30 12:49:02,069 - INFO -     Expected Rate: 5.00%
2026-01-30 12:49:02,069 - INFO -     Difference: +0.41%
2026-01-30 12:49:02,069 - INFO - 
  GARCH_X:
2026-01-30 12:49:02,069 - INFO -     Violations: 68 / 1258
2026-01-30 12:49:02,070 - INFO -     Actual Rate: 5.41%
2026-01-30 12:49:02,070 - INFO -     Expected Rate: 5.00%
2026-01-30 12:49:02,071 - INFO -     Difference: +0.41%
2026-01-30 12:49:02,071 - INFO - 
============================================================
2026-01-30 12:49:02,072 - INFO -   Confidence Level: 99%
2026-01-30 12:49:02,072 - INFO -   Expected Violation Rate: 1.00%
2026-01-30 12:49:02,073 - INFO - ============================================================
2026-01-30 12:49:02,073 - INFO - 
  Historical_Variance_T126:
2026-01-30 12:49:02,074 - INFO -     Violations: 26 / 1258
2026-01-30 12:49:02,074 - INFO -     Actual Rate: 2.07%
2026-01-30 12:49:02,075 - INFO -     Expected Rate: 1.00%
2026-01-30 12:49:02,075 - INFO -     Difference: +1.07%
2026-01-30 12:49:02,076 - INFO - 
  Riskmetric:
2026-01-30 12:49:02,077 - INFO -     Violations: 31 / 1258
2026-01-30 12:49:02,078 - INFO -     Actual Rate: 2.46%
2026-01-30 12:49:02,078 - INFO -     Expected Rate: 1.00%
2026-01-30 12:49:02,079 - INFO -     Difference: +1.46%
2026-01-30 12:49:02,079 - INFO - 
  ARCH:
2026-01-30 12:49:02,080 - INFO -     Violations: 30 / 1258
2026-01-30 12:49:02,080 - INFO -     Actual Rate: 2.38%
2026-01-30 12:49:02,080 - INFO -     Expected Rate: 1.00%
2026-01-30 12:49:02,081 - INFO -     Difference: +1.38%
2026-01-30 12:49:02,081 - INFO - 
  GARCH:
2026-01-30 12:49:02,082 - INFO -     Violations: 26 / 1258
2026-01-30 12:49:02,083 - INFO -     Actual Rate: 2.07%
2026-01-30 12:49:02,083 - INFO -     Expected Rate: 1.00%
2026-01-30 12:49:02,084 - INFO -     Difference: +1.07%
2026-01-30 12:49:02,084 - INFO - 
  Threshold_GARCH:
2026-01-30 12:49:02,084 - INFO -     Violations: 27 / 1258
2026-01-30 12:49:02,085 - INFO -     Actual Rate: 2.15%
2026-01-30 12:49:02,085 - INFO -     Expected Rate: 1.00%
2026-01-30 12:49:02,086 - INFO -     Difference: +1.15%
2026-01-30 12:49:02,086 - INFO - 
  GARCH_X:
2026-01-30 12:49:02,087 - INFO -     Violations: 22 / 1258
2026-01-30 12:49:02,087 - INFO -     Actual Rate: 1.75%
2026-01-30 12:49:02,088 - INFO -     Expected Rate: 1.00%
2026-01-30 12:49:02,088 - INFO -     Difference: +0.75%
2026-01-30 12:49:02,089 - INFO - 
================================================================================
2026-01-30 12:49:02,089 - INFO - CHRISTOFFERSEN UNCONDITIONAL COVERAGE (UC) TEST
2026-01-30 12:49:02,089 - INFO - ================================================================================
2026-01-30 12:49:02,090 - INFO - H0: The VaR model has correct unconditional coverage
2026-01-30 12:49:02,090 - INFO -     (observed violation rate = expected violation rate)
2026-01-30 12:49:02,091 - INFO - Reject H0 if p-value < 0.05 (model has incorrect coverage)

2026-01-30 12:49:02,096 - INFO - Confidence Level: 90%
2026-01-30 12:49:02,104 - INFO - 
  Historical_Variance_T126:
2026-01-30 12:49:02,105 - INFO -     Violations: 97 (Expected: 125.80)
2026-01-30 12:49:02,105 - INFO -     Violation Rate: 7.71% (Expected: 10.00%)
2026-01-30 12:49:02,106 - INFO -     LR_UC Statistic: 7.8899
2026-01-30 12:49:02,106 - INFO -     p-value: 0.0050
2026-01-30 12:49:02,111 - INFO - 
  Riskmetric:
2026-01-30 12:49:02,111 - INFO -     Violations: 104 (Expected: 125.80)
2026-01-30 12:49:02,112 - INFO -     Violation Rate: 8.27% (Expected: 10.00%)
2026-01-30 12:49:02,112 - INFO -     LR_UC Statistic: 4.4342
2026-01-30 12:49:02,112 - INFO -     p-value: 0.0352
2026-01-30 12:49:02,116 - INFO - 
  ARCH:
2026-01-30 12:49:02,117 - INFO -     Violations: 119 (Expected: 125.80)
2026-01-30 12:49:02,117 - INFO -     Violation Rate: 9.46% (Expected: 10.00%)
2026-01-30 12:49:02,118 - INFO -     LR_UC Statistic: 0.4151
2026-01-30 12:49:02,118 - INFO -     p-value: 0.5194
2026-01-30 12:49:02,122 - INFO - 
  GARCH:
2026-01-30 12:49:02,123 - INFO -     Violations: 102 (Expected: 125.80)
2026-01-30 12:49:02,123 - INFO -     Violation Rate: 8.11% (Expected: 10.00%)
2026-01-30 12:49:02,124 - INFO -     LR_UC Statistic: 5.3138
2026-01-30 12:49:02,125 - INFO -     p-value: 0.0212
2026-01-30 12:49:02,129 - INFO - 
  Threshold_GARCH:
2026-01-30 12:49:02,130 - INFO -     Violations: 103 (Expected: 125.80)
2026-01-30 12:49:02,131 - INFO -     Violation Rate: 8.19% (Expected: 10.00%)
2026-01-30 12:49:02,131 - INFO -     LR_UC Statistic: 4.8634
2026-01-30 12:49:02,132 - INFO -     p-value: 0.0274
2026-01-30 12:49:02,136 - INFO - 
  GARCH_X:
2026-01-30 12:49:02,138 - INFO -     Violations: 100 (Expected: 125.80)
2026-01-30 12:49:02,138 - INFO -     Violation Rate: 7.95% (Expected: 10.00%)
2026-01-30 12:49:02,139 - INFO -     LR_UC Statistic: 6.2789
2026-01-30 12:49:02,139 - INFO -     p-value: 0.0122
2026-01-30 12:49:02,148 - INFO - Confidence Level: 95%
2026-01-30 12:49:02,156 - INFO - 
  Historical_Variance_T126:
2026-01-30 12:49:02,157 - INFO -     Violations: 62 (Expected: 62.90)
2026-01-30 12:49:02,157 - INFO -     Violation Rate: 4.93% (Expected: 5.00%)
2026-01-30 12:49:02,157 - INFO -     LR_UC Statistic: 0.0136
2026-01-30 12:49:02,158 - INFO -     p-value: 0.9071
2026-01-30 12:49:02,163 - INFO - 
  Riskmetric:
2026-01-30 12:49:02,163 - INFO -     Violations: 69 (Expected: 62.90)
2026-01-30 12:49:02,164 - INFO -     Violation Rate: 5.48% (Expected: 5.00%)
2026-01-30 12:49:02,164 - INFO -     LR_UC Statistic: 0.6045
2026-01-30 12:49:02,165 - INFO -     p-value: 0.4369
2026-01-30 12:49:02,170 - INFO - 
  ARCH:
2026-01-30 12:49:02,170 - INFO -     Violations: 67 (Expected: 62.90)
2026-01-30 12:49:02,171 - INFO -     Violation Rate: 5.33% (Expected: 5.00%)
2026-01-30 12:49:02,171 - INFO -     LR_UC Statistic: 0.2757
2026-01-30 12:49:02,171 - INFO -     p-value: 0.5995
2026-01-30 12:49:02,176 - INFO - 
  GARCH:
2026-01-30 12:49:02,177 - INFO -     Violations: 68 (Expected: 62.90)
2026-01-30 12:49:02,177 - INFO -     Violation Rate: 5.41% (Expected: 5.00%)
2026-01-30 12:49:02,178 - INFO -     LR_UC Statistic: 0.4246
2026-01-30 12:49:02,179 - INFO -     p-value: 0.5147
2026-01-30 12:49:02,185 - INFO - 
  Threshold_GARCH:
2026-01-30 12:49:02,185 - INFO -     Violations: 68 (Expected: 62.90)
2026-01-30 12:49:02,186 - INFO -     Violation Rate: 5.41% (Expected: 5.00%)
2026-01-30 12:49:02,186 - INFO -     LR_UC Statistic: 0.4246
2026-01-30 12:49:02,187 - INFO -     p-value: 0.5147
2026-01-30 12:49:02,191 - INFO - 
  GARCH_X:
2026-01-30 12:49:02,192 - INFO -     Violations: 68 (Expected: 62.90)
2026-01-30 12:49:02,193 - INFO -     Violation Rate: 5.41% (Expected: 5.00%)
2026-01-30 12:49:02,193 - INFO -     LR_UC Statistic: 0.4246
2026-01-30 12:49:02,194 - INFO -     p-value: 0.5147
2026-01-30 12:49:02,204 - INFO - Confidence Level: 99%
2026-01-30 12:49:02,210 - INFO - 
  Historical_Variance_T126:
2026-01-30 12:49:02,211 - INFO -     Violations: 26 (Expected: 12.58)
2026-01-30 12:49:02,212 - INFO -     Violation Rate: 2.07% (Expected: 1.00%)
2026-01-30 12:49:02,212 - INFO -     LR_UC Statistic: 11.0565
2026-01-30 12:49:02,212 - INFO -     p-value: 0.0009
2026-01-30 12:49:02,218 - INFO - 
  Riskmetric:
2026-01-30 12:49:02,218 - INFO -     Violations: 31 (Expected: 12.58)
2026-01-30 12:49:02,219 - INFO -     Violation Rate: 2.46% (Expected: 1.00%)
2026-01-30 12:49:02,220 - INFO -     LR_UC Statistic: 19.3503
2026-01-30 12:49:02,220 - INFO -     p-value: 0.0000
2026-01-30 12:49:02,224 - INFO - 
  ARCH:
2026-01-30 12:49:02,225 - INFO -     Violations: 30 (Expected: 12.58)
2026-01-30 12:49:02,225 - INFO -     Violation Rate: 2.38% (Expected: 1.00%)
2026-01-30 12:49:02,225 - INFO -     LR_UC Statistic: 17.5501
2026-01-30 12:49:02,226 - INFO -     p-value: 0.0000
2026-01-30 12:49:02,230 - INFO - 
  GARCH:
2026-01-30 12:49:02,231 - INFO -     Violations: 26 (Expected: 12.58)
2026-01-30 12:49:02,232 - INFO -     Violation Rate: 2.07% (Expected: 1.00%)
2026-01-30 12:49:02,232 - INFO -     LR_UC Statistic: 11.0565
2026-01-30 12:49:02,232 - INFO -     p-value: 0.0009
2026-01-30 12:49:02,237 - INFO - 
  Threshold_GARCH:
2026-01-30 12:49:02,237 - INFO -     Violations: 27 (Expected: 12.58)
2026-01-30 12:49:02,238 - INFO -     Violation Rate: 2.15% (Expected: 1.00%)
2026-01-30 12:49:02,238 - INFO -     LR_UC Statistic: 12.5690
2026-01-30 12:49:02,238 - INFO -     p-value: 0.0004
2026-01-30 12:49:02,242 - INFO - 
  GARCH_X:
2026-01-30 12:49:02,243 - INFO -     Violations: 22 (Expected: 12.58)
2026-01-30 12:49:02,243 - INFO -     Violation Rate: 1.75% (Expected: 1.00%)
2026-01-30 12:49:02,244 - INFO -     LR_UC Statistic: 5.8245
2026-01-30 12:49:02,244 - INFO -     p-value: 0.0158
2026-01-30 12:49:02,249 - INFO - 
================================================================================
2026-01-30 12:49:02,249 - INFO - CHRISTOFFERSEN INDEPENDENCE TEST
2026-01-30 12:49:02,250 - INFO - ================================================================================
2026-01-30 12:49:02,250 - INFO - H0: VaR violations are independently distributed (no clustering)
2026-01-30 12:49:02,251 - INFO - Reject H0 if p-value < 0.05 (violations are clustered)

2026-01-30 12:49:02,255 - INFO - Confidence Level: 90%
2026-01-30 12:49:02,262 - INFO - 
  Historical_Variance_T126:
2026-01-30 12:49:02,262 - INFO -     Transition Matrix:
2026-01-30 12:49:02,279 - INFO -     Total Violations: 97
2026-01-30 12:49:02,280 - INFO -     LR_Ind Statistic: 2.7801
2026-01-30 12:49:02,280 - INFO -     p-value: 0.0954
2026-01-30 12:49:02,285 - INFO - 
  Riskmetric:
2026-01-30 12:49:02,286 - INFO -     Transition Matrix:
2026-01-30 12:49:02,303 - INFO -     Total Violations: 104
2026-01-30 12:49:02,303 - INFO -     LR_Ind Statistic: 0.7391
2026-01-30 12:49:02,304 - INFO -     p-value: 0.3900
2026-01-30 12:49:02,308 - INFO - 
  ARCH:
2026-01-30 12:49:02,308 - INFO -     Transition Matrix:
2026-01-30 12:49:02,325 - INFO -     Total Violations: 119
2026-01-30 12:49:02,325 - INFO -     LR_Ind Statistic: 2.2206
2026-01-30 12:49:02,326 - INFO -     p-value: 0.1362
2026-01-30 12:49:02,330 - INFO - 
  GARCH:
2026-01-30 12:49:02,331 - INFO -     Transition Matrix:
2026-01-30 12:49:02,347 - INFO -     Total Violations: 102
2026-01-30 12:49:02,348 - INFO -     LR_Ind Statistic: 0.4027
2026-01-30 12:49:02,348 - INFO -     p-value: 0.5257
2026-01-30 12:49:02,353 - INFO - 
  Threshold_GARCH:
2026-01-30 12:49:02,353 - INFO -     Transition Matrix:
2026-01-30 12:49:02,371 - INFO -     Total Violations: 103
2026-01-30 12:49:02,371 - INFO -     LR_Ind Statistic: 0.0276
2026-01-30 12:49:02,372 - INFO -     p-value: 0.8680
2026-01-30 12:49:02,376 - INFO - 
  GARCH_X:
2026-01-30 12:49:02,376 - INFO -     Transition Matrix:
2026-01-30 12:49:02,393 - INFO -     Total Violations: 100
2026-01-30 12:49:02,393 - INFO -     LR_Ind Statistic: 4.6068
2026-01-30 12:49:02,394 - INFO -     p-value: 0.0318
2026-01-30 12:49:02,402 - INFO - Confidence Level: 95%
2026-01-30 12:49:02,409 - INFO - 
  Historical_Variance_T126:
2026-01-30 12:49:02,410 - INFO -     Transition Matrix:
2026-01-30 12:49:02,426 - INFO -     Total Violations: 62
2026-01-30 12:49:02,426 - INFO -     LR_Ind Statistic: 0.2953
2026-01-30 12:49:02,427 - INFO -     p-value: 0.5869
2026-01-30 12:49:02,431 - INFO - 
  Riskmetric:
2026-01-30 12:49:02,432 - INFO -     Transition Matrix:
2026-01-30 12:49:02,449 - INFO -     Total Violations: 69
2026-01-30 12:49:02,449 - INFO -     LR_Ind Statistic: 0.3989
2026-01-30 12:49:02,449 - INFO -     p-value: 0.5276
2026-01-30 12:49:02,454 - INFO - 
  ARCH:
2026-01-30 12:49:02,454 - INFO -     Transition Matrix:
2026-01-30 12:49:02,470 - INFO -     Total Violations: 67
2026-01-30 12:49:02,471 - INFO -     LR_Ind Statistic: 0.9028
2026-01-30 12:49:02,472 - INFO -     p-value: 0.3420
2026-01-30 12:49:02,476 - INFO - 
  GARCH:
2026-01-30 12:49:02,477 - INFO -     Transition Matrix:
2026-01-30 12:49:02,493 - INFO -     Total Violations: 68
2026-01-30 12:49:02,494 - INFO -     LR_Ind Statistic: 0.0306
2026-01-30 12:49:02,494 - INFO -     p-value: 0.8611
2026-01-30 12:49:02,498 - INFO - 
  Threshold_GARCH:
2026-01-30 12:49:02,499 - INFO -     Transition Matrix:
2026-01-30 12:49:02,516 - INFO -     Total Violations: 68
2026-01-30 12:49:02,516 - INFO -     LR_Ind Statistic: 0.0306
2026-01-30 12:49:02,517 - INFO -     p-value: 0.8611
2026-01-30 12:49:02,520 - INFO - 
  GARCH_X:
2026-01-30 12:49:02,521 - INFO -     Transition Matrix:
2026-01-30 12:49:02,537 - INFO -     Total Violations: 68
2026-01-30 12:49:02,537 - INFO -     LR_Ind Statistic: 0.1484
2026-01-30 12:49:02,538 - INFO -     p-value: 0.7001
2026-01-30 12:49:02,546 - INFO - Confidence Level: 99%
2026-01-30 12:49:02,554 - INFO - 
  Historical_Variance_T126:
2026-01-30 12:49:02,554 - INFO -     Transition Matrix:
2026-01-30 12:49:02,572 - INFO -     Total Violations: 26
2026-01-30 12:49:02,573 - INFO -     LR_Ind Statistic: 5.8863
2026-01-30 12:49:02,574 - INFO -     p-value: 0.0153
2026-01-30 12:49:02,578 - INFO - 
  Riskmetric:
2026-01-30 12:49:02,579 - INFO -     Transition Matrix:
2026-01-30 12:49:02,595 - INFO -     Total Violations: 31
2026-01-30 12:49:02,596 - INFO -     LR_Ind Statistic: 0.0698
2026-01-30 12:49:02,596 - INFO -     p-value: 0.7917
2026-01-30 12:49:02,601 - INFO - 
  ARCH:
2026-01-30 12:49:02,602 - INFO -     Transition Matrix:
2026-01-30 12:49:02,647 - INFO -     Total Violations: 30
2026-01-30 12:49:02,647 - INFO -     LR_Ind Statistic: 1.4671
2026-01-30 12:49:02,648 - INFO -     p-value: 0.2258
2026-01-30 12:49:02,656 - INFO - 
  GARCH:
2026-01-30 12:49:02,657 - INFO -     Transition Matrix:
2026-01-30 12:49:02,678 - INFO -     Total Violations: 26
2026-01-30 12:49:02,678 - INFO -     LR_Ind Statistic: 1.0984
2026-01-30 12:49:02,679 - INFO -     p-value: 0.2946
2026-01-30 12:49:02,682 - INFO - 
  Threshold_GARCH:
2026-01-30 12:49:02,683 - INFO -     Transition Matrix:
2026-01-30 12:49:02,697 - INFO -     Total Violations: 27
2026-01-30 12:49:02,697 - INFO -     LR_Ind Statistic: 1.1855
2026-01-30 12:49:02,698 - INFO -     p-value: 0.2762
2026-01-30 12:49:02,702 - INFO - 
  GARCH_X:
2026-01-30 12:49:02,702 - INFO -     Transition Matrix:
2026-01-30 12:49:02,718 - INFO -     Total Violations: 22
2026-01-30 12:49:02,718 - INFO -     LR_Ind Statistic: 0.7838
2026-01-30 12:49:02,719 - INFO -     p-value: 0.3760
2026-01-30 12:49:02,723 - INFO - 
================================================================================
2026-01-30 12:49:02,723 - INFO - SUMMARY OF CHRISTOFFERSEN TESTS
2026-01-30 12:49:02,723 - INFO - ================================================================================
2026-01-30 12:49:02,724 - INFO - 
90% Confidence Level:
2026-01-30 12:49:02,724 - INFO - Model                     UC Test         Ind Test        Overall
2026-01-30 12:49:02,725 - INFO - ----------------------------------------------------------------------
2026-01-30 12:49:02,725 - INFO - Historical_Variance_T126  FAIL            PASS            FAIL
2026-01-30 12:49:02,725 - INFO - Riskmetric                FAIL            PASS            FAIL
2026-01-30 12:49:02,726 - INFO - ARCH                      PASS            PASS            PASS
2026-01-30 12:49:02,726 - INFO - GARCH                     FAIL            PASS            FAIL
2026-01-30 12:49:02,727 - INFO - Threshold_GARCH           FAIL            PASS            FAIL
2026-01-30 12:49:02,727 - INFO - GARCH_X                   FAIL            FAIL            FAIL
2026-01-30 12:49:02,727 - INFO - 
95% Confidence Level:
2026-01-30 12:49:02,728 - INFO - Model                     UC Test         Ind Test        Overall
2026-01-30 12:49:02,729 - INFO - ----------------------------------------------------------------------
2026-01-30 12:49:02,729 - INFO - Historical_Variance_T126  PASS            PASS            PASS
2026-01-30 12:49:02,730 - INFO - Riskmetric                PASS            PASS            PASS
2026-01-30 12:49:02,730 - INFO - ARCH                      PASS            PASS            PASS
2026-01-30 12:49:02,730 - INFO - GARCH                     PASS            PASS            PASS
2026-01-30 12:49:02,731 - INFO - Threshold_GARCH           PASS            PASS            PASS
2026-01-30 12:49:02,731 - INFO - GARCH_X                   PASS            PASS            PASS
2026-01-30 12:49:02,731 - INFO - 
99% Confidence Level:
2026-01-30 12:49:02,732 - INFO - Model                     UC Test         Ind Test        Overall
2026-01-30 12:49:02,732 - INFO - ----------------------------------------------------------------------
2026-01-30 12:49:02,733 - INFO - Historical_Variance_T126  FAIL            FAIL            FAIL
2026-01-30 12:49:02,733 - INFO - Riskmetric                FAIL            PASS            FAIL
2026-01-30 12:49:02,733 - INFO - ARCH                      FAIL            PASS            FAIL
2026-01-30 12:49:02,734 - INFO - GARCH                     FAIL            PASS            FAIL
2026-01-30 12:49:02,734 - INFO - Threshold_GARCH           FAIL            PASS            FAIL
2026-01-30 12:49:02,734 - INFO - GARCH_X                   FAIL            PASS            FAIL
2026-01-30 12:49:02,735 - INFO - 
================================================================================
2026-01-30 12:49:02,735 - INFO - Note: A model PASSES if it fails to reject H0 (p-value >= 0.05)
2026-01-30 12:49:02,735 - INFO -       UC Test: Correct unconditional coverage
2026-01-30 12:49:02,736 - INFO -       Ind Test: Independent violations (no clustering)
2026-01-30 12:49:02,736 - INFO - ================================================================================
